bank_name,category,product_name,features,fees,interest_rate,eligibility
ICICI,Credit Card,ICICI Coral,5% cashback on dining; Lounge access,Rs. 500 + Taxes,3.5% p.m.,Income > 30k/month
ICICI,Credit Card,ICICI Rubyx,Travel rewards; Unlimited lounge,Rs. 3000 + Taxes,3.4% p.m.,Income > 6L PA
ICICI,Debit Card,ICICI Platinum,International usage; Reward points,Rs. 200,N/A,Account Holder
ICICI,Loan,ICICI Home Loan,Quick approval; Low interest rates,0.5% of loan,8.5% - 9.5%,Salaried/Self-Employed
ICICI,Loan,ICICI Personal Loan,Instant approval; No collateral,1%,10.5% - 14.5%,Salaried
ICICI,Scheme,ICICI Sukanya Samriddhi,Girl child savings scheme,Nil,8.2%,Guardian